{
  "$schema": "https://json-schema.org/draft/2020-12/schema",
  "$id": "qualification-signer-registry.schema.json",
  "title": "OpenAdapt qualification signer registry v2",
  "type": "object",
  "additionalProperties": false,
  "required": ["schema_version", "revision", "generated_at", "expires_at", "signers"],
  "properties": {
    "schema_version": {"const": "openadapt.qualification-signer-registry/v2"},
    "revision": {"type": "integer", "minimum": 1},
    "generated_at": {"$ref": "#/$defs/timestamp"},
    "expires_at": {"$ref": "#/$defs/timestamp"},
    "signers": {
      "type": "array",
      "minItems": 1,
      "uniqueItems": true,
      "items": {"$ref": "#/$defs/signer"}
    }
  },
  "$defs": {
    "digest": {"type": "string", "pattern": "^sha256:[0-9a-f]{64}$"},
    "timestamp": {
      "type": "string",
      "pattern": "^[0-9]{4}-[0-9]{2}-[0-9]{2}T[0-9]{2}:[0-9]{2}:[0-9]{2}Z$"
    },
    "signer": {
      "oneOf": [
        {"$ref": "#/$defs/ed25519_signer"},
        {"$ref": "#/$defs/kms_ed25519_signer"},
        {"$ref": "#/$defs/public_trust_p256_signer"},
        {"$ref": "#/$defs/public_trust_software_ed25519_signer"}
      ]
    },
    "ed25519_signer": {
      "type": "object",
      "additionalProperties": false,
      "required": [
        "algorithm", "key_id", "public_key", "public_key_spki_der_base64",
        "public_key_sha256",
        "statement_schema_versions", "allowed_usages", "allowed_workflows",
        "allowed_ref_prefixes", "status", "revoked_at"
      ],
      "properties": {
        "algorithm": {"const": "ed25519"},
        "key_id": {"type": "string", "pattern": "^qa-ed25519-[0-9a-f]{16}$"},
        "public_key": {"type": "string", "pattern": "^[A-Za-z0-9_-]{43}$"},
        "public_key_spki_der_base64": {
          "type": "string",
          "pattern": "^[A-Za-z0-9+/]{59}=$"
        },
        "public_key_sha256": {"$ref": "#/$defs/digest"},
        "statement_schema_versions": {
          "const": ["openadapt.qualification-evidence-signing-statement/v1"]
        },
        "allowed_usages": {
          "type": "array",
          "minItems": 1,
          "uniqueItems": true,
          "items": {
            "enum": [
              "private-qualification-evidence-decision",
              "private-qualification-evidence-decision-final-manifest",
              "private-qualification-evidence-decision-request",
              "private-qualification-evidence-decision-storage-seal",
              "private-qualification-evidence-recovery-receipt",
              "private-qualification-evidence-manifest",
              "qualification-authority-state-receipt",
              "qualification-campaign-permit",
              "qualification-evidence-decision-receipt",
              "qualification-revocation-state-receipt",
              "qualification-source-evidence-manifest",
              "qualification-trial-receipt"
            ]
          }
        },
        "allowed_workflows": {
          "type": "array",
          "minItems": 1,
          "uniqueItems": true,
          "items": {
            "type": "string",
            "pattern": "^https://github\\.com/OpenAdaptAI/[A-Za-z0-9_.-]+/\\.github/workflows/[A-Za-z0-9_.-]+\\.ya?ml@refs/heads/[A-Za-z0-9._/-]+$"
          }
        },
        "allowed_ref_prefixes": {
          "type": "array",
          "minItems": 1,
          "uniqueItems": true,
          "items": {"type": "string", "pattern": "^refs/"}
        },
        "status": {"enum": ["active", "revoked"]},
        "revoked_at": {
          "oneOf": [{"$ref": "#/$defs/timestamp"}, {"type": "null"}]
        }
      }
    },
    "kms_ed25519_signer": {
      "type": "object",
      "additionalProperties": false,
      "required": [
        "algorithm", "key_id", "key_origin", "kms_key_arn", "public_key",
        "public_key_spki_der_base64", "public_key_sha256", "signature_encoding",
        "statement_schema_versions", "allowed_usages", "allowed_workflows",
        "allowed_ref_prefixes", "allowed_environments", "status", "revoked_at"
      ],
      "properties": {
        "algorithm": {"const": "ed25519"},
        "key_id": {"type": "string", "pattern": "^qa-ed25519-[0-9a-f]{16}$"},
        "key_origin": {"const": "aws-kms"},
        "kms_key_arn": {"type": "string", "pattern": "^arn:aws:kms:us-east-1:992382684924:key/[0-9a-f]{8}-[0-9a-f]{4}-[0-9a-f]{4}-[0-9a-f]{4}-[0-9a-f]{12}$"},
        "public_key": {"type": "string", "pattern": "^[A-Za-z0-9_-]{43}$"},
        "public_key_spki_der_base64": {"type": "string", "pattern": "^[A-Za-z0-9+/]{59}=$"},
        "public_key_sha256": {"$ref": "#/$defs/digest"},
        "signature_encoding": {"const": "raw-64-base64-rfc4648-padded"},
        "statement_schema_versions": {"const": ["openadapt.qualification-evidence-signing-statement/v1"]},
        "allowed_usages": {"const": ["qualification-evidence-decision-receipt"]},
        "allowed_workflows": {"const": ["https://github.com/OpenAdaptAI/.github/.github/workflows/issue-synthetic-qualification-evidence-decision.yml@refs/heads/main"]},
        "allowed_ref_prefixes": {"const": ["refs/heads/main"]},
        "allowed_environments": {"const": ["synthetic-qualification-evidence-decision"]},
        "status": {"enum": ["active", "revoked"]},
        "revoked_at": {"oneOf": [{"$ref": "#/$defs/timestamp"}, {"type": "null"}]}
      }
    },
    "public_trust_p256_signer": {
      "type": "object",
      "additionalProperties": false,
      "required": [
        "algorithm", "key_id", "key_origin", "kms_key_arn", "public_key",
        "public_key_spki_der_base64", "public_key_sha256", "signature_encoding",
        "statement_schema_versions", "allowed_usages", "allowed_kinds",
        "allowed_workflows", "allowed_ref_prefixes", "allowed_environments",
        "status", "revoked_at"
      ],
      "properties": {
        "algorithm": {"const": "ecdsa-p256-sha256"},
        "key_id": {"type": "string", "pattern": "^oa-public-trust-p256-[0-9a-f]{16}$"},
        "key_origin": {"const": "aws-kms"},
        "kms_key_arn": {"type": "string", "pattern": "^arn:aws:kms:us-east-1:992382684924:key/[0-9a-f]{8}-[0-9a-f]{4}-[0-9a-f]{4}-[0-9a-f]{4}-[0-9a-f]{12}$"},
        "public_key": {"type": "string", "pattern": "^[A-Za-z0-9_-]{87}$"},
        "public_key_spki_der_base64": {"type": "string", "pattern": "^[A-Za-z0-9+/]{122}==$"},
        "public_key_sha256": {"$ref": "#/$defs/digest"},
        "signature_encoding": {"const": "asn1-der-low-s-base64-rfc4648-padded"},
        "statement_schema_versions": {"const": ["openadapt.production-public-trust-signing-statement/v1"]},
        "allowed_usages": {"const": ["production-public-evidence"]},
        "allowed_kinds": {
          "type": "array",
          "minItems": 1,
          "uniqueItems": true,
          "items": {
            "enum": [
              "production-acceptance-manifest",
              "production-acceptance-summary",
              "production-cloud-deploy-authorization",
              "production-cloud-deployment-result",
              "production-current-default",
              "production-deployment-observation",
              "production-lifecycle-checkpoint",
              "qualification-admission",
              "qualification-authority-state-receipt",
              "qualification-campaign-permit",
              "qualification-campaign-permit-policy",
              "qualification-campaign-permit-receipt",
              "qualification-campaign-permit-request",
              "qualification-evidence-decision-receipt",
              "qualification-release",
              "qualification-revocation-state-receipt",
              "support-release-admission"
            ]
          }
        },
        "allowed_workflows": {
          "const": ["https://github.com/OpenAdaptAI/.github/.github/workflows/sign-production-evidence.yml@refs/heads/main"]
        },
        "allowed_ref_prefixes": {"const": ["refs/heads/main"]},
        "allowed_environments": {"const": ["public-trust-signing"]},
        "status": {"enum": ["active", "revoked"]},
        "revoked_at": {
          "oneOf": [{"$ref": "#/$defs/timestamp"}, {"type": "null"}]
        }
      }
    },
    "public_trust_software_ed25519_signer": {
      "type": "object",
      "additionalProperties": false,
      "required": [
        "algorithm", "key_id", "key_origin", "public_key",
        "public_key_spki_der_base64", "public_key_sha256", "signature_encoding",
        "statement_schema_versions", "allowed_usages", "allowed_kinds",
        "allowed_workflows", "allowed_ref_prefixes", "allowed_environments",
        "status", "revoked_at"
      ],
      "properties": {
        "algorithm": {"const": "ed25519"},
        "key_id": {"type": "string", "pattern": "^oa-public-trust-ed25519-[0-9a-f]{16}$"},
        "key_origin": {"const": "software"},
        "public_key": {"type": "string", "pattern": "^[A-Za-z0-9_-]{43}$"},
        "public_key_spki_der_base64": {"type": "string", "pattern": "^[A-Za-z0-9+/]{59}=$"},
        "public_key_sha256": {"$ref": "#/$defs/digest"},
        "signature_encoding": {"const": "raw-64-base64-rfc4648-padded"},
        "statement_schema_versions": {"const": ["openadapt.production-public-trust-signing-statement/v1"]},
        "allowed_usages": {"const": ["production-public-evidence"]},
        "allowed_kinds": {
          "type": "array",
          "minItems": 1,
          "uniqueItems": true,
          "items": {
            "enum": [
              "production-acceptance-manifest",
              "production-acceptance-summary",
              "production-cloud-deploy-authorization",
              "production-cloud-deployment-result",
              "production-current-default",
              "production-deployment-observation",
              "production-lifecycle-checkpoint",
              "qualification-admission",
              "qualification-authority-state-receipt",
              "qualification-campaign-permit",
              "qualification-campaign-permit-policy",
              "qualification-campaign-permit-receipt",
              "qualification-campaign-permit-request",
              "qualification-evidence-decision-receipt",
              "qualification-release",
              "qualification-revocation-state-receipt",
              "support-release-admission"
            ]
          }
        },
        "allowed_workflows": {
          "const": ["https://github.com/OpenAdaptAI/.github/.github/workflows/sign-production-evidence-software.yml@refs/heads/main"]
        },
        "allowed_ref_prefixes": {"const": ["refs/heads/main"]},
        "allowed_environments": {"const": ["synthetic-qualification-evidence-decision"]},
        "status": {"enum": ["active", "revoked"]},
        "revoked_at": {
          "oneOf": [{"$ref": "#/$defs/timestamp"}, {"type": "null"}]
        }
      }
    }
  }
}
