{"expires_at":"2026-09-09T17:59:26Z","generated_at":"2026-09-02T17:59:26Z","revision":1,"schema_version":"openadapt.qualification-signer-registry/v2","signers":[{"algorithm":"ed25519","allowed_ref_prefixes":["refs/heads/main"],"allowed_usages":["qualification-authority-state-receipt","qualification-evidence-decision-receipt","qualification-revocation-state-receipt"],"allowed_workflows":["https://github.com/OpenAdaptAI/.github/.github/workflows/issue-synthetic-qualification-evidence-decision.yml@refs/heads/main","https://github.com/OpenAdaptAI/openadapt-ops/.github/workflows/qualification-authority-state.yml@refs/heads/main","https://github.com/OpenAdaptAI/openadapt-ops/.github/workflows/qualification-revocation-state.yml@refs/heads/main"],"key_id":"qa-ed25519-9cf4bca214c01d79","public_key":"vHPUDLG2WD2BnTLaKYnZd9GxvUKfjpd68gJ9HubIEH8","public_key_sha256":"sha256:465646ab5137f05dfba094fb05fc10e3af74a0c2e2d0fcc20814b8f1f8271170","public_key_spki_der_base64":"MCowBQYDK2VwAyEAvHPUDLG2WD2BnTLaKYnZd9GxvUKfjpd68gJ9HubIEH8=","revoked_at":null,"statement_schema_versions":["openadapt.qualification-evidence-signing-statement/v1"],"status":"active"},{"algorithm":"ed25519","allowed_environments":["synthetic-qualification-evidence-decision"],"allowed_kinds":["production-acceptance-manifest","production-acceptance-summary","production-cloud-deploy-authorization","production-cloud-deployment-result","production-current-default","production-deployment-observation","production-lifecycle-checkpoint","qualification-admission","qualification-authority-state-receipt","qualification-campaign-permit","qualification-campaign-permit-policy","qualification-campaign-permit-receipt","qualification-campaign-permit-request","qualification-evidence-decision-receipt","qualification-release","qualification-revocation-state-receipt","support-release-admission"],"allowed_ref_prefixes":["refs/heads/main"],"allowed_usages":["production-public-evidence"],"allowed_workflows":["https://github.com/OpenAdaptAI/.github/.github/workflows/sign-production-evidence-software.yml@refs/heads/main"],"key_id":"oa-public-trust-ed25519-9cf4bca214c01d79","key_origin":"software","public_key":"vHPUDLG2WD2BnTLaKYnZd9GxvUKfjpd68gJ9HubIEH8","public_key_sha256":"sha256:465646ab5137f05dfba094fb05fc10e3af74a0c2e2d0fcc20814b8f1f8271170","public_key_spki_der_base64":"MCowBQYDK2VwAyEAvHPUDLG2WD2BnTLaKYnZd9GxvUKfjpd68gJ9HubIEH8=","revoked_at":null,"signature_encoding":"raw-64-base64-rfc4648-padded","statement_schema_versions":["openadapt.production-public-trust-signing-statement/v1"],"status":"active"}]}
